{
    "version": 2,
    "taxmaps":[
        [["gA","D"],["gB","D"],["gC","E"]],
        [["D","F"],["E","F"]]
    ],
    "genomes":[
        ["gA", 1, [
            ["subjA1",100]
        ]],
        ["gB", 1, [
            ["subjB1",20],["subjB2",30]
        ]],
        ["gC", 2, [
            ["subjC3",80],["subjC2",100],["subjC1",40]
        ]]
    ],
    "sequences":[
        ["s1",25,[
            ["subjA1",5,29],["subjA1",10,34]
        ]],
        ["s2",40,[
            ["subjA1",1,40]
        ]],
        ["s3",50,[
            ["subjA1",51,98]
        ]],
        ["s4",60,[    
        ]],
        ["s5",25,[   
        ]],
        ["s6",10,[
            ["subjB1",5,14],["subjB2",21,30]
        ]],
        ["s7",20,[
            ["subjA1",21,40],["subjB1",1,20]
        ]],
        ["s8",25,[
            ["subjA1",2,26],["subjB2",2,26]
        ]],
        ["s9",25,[
            ["subjB2",5,29]
        ]],
        ["s10",30,[
            ["subjC1",1,30],["subjC2",80,20]
        ]],
        ["s11",50,[
            ["subjC2",25,45]
        ]]
    ]
}
